{"id":1436430,"items":[{"id":1436431,"status":2,"title":"home","order":0,"templateKey":null,"pageLinks":[]}],"metaTags":null,"order":"0","headHtml":null,"customCss":null,"headerHtml":"<section class=\"u-clearfix u-header u-typography-Normal--Header u-white u-block-2f14-1\" custom-posts-hash=\"[]\" data-style=\"header-bar-center\" data-section-properties=\"{&quot;grid-spacing&quot;:&quot;0&quot;,&quot;align&quot;:&quot;left&quot;,&quot;stretch&quot;:true}\" data-id=\"2f14\" color-allocation=\"{&quot;name&quot;:&quot;header-section-light&quot;,&quot;section&quot;:&quot;white&quot;,&quot;cell-filled&quot;:&quot;white, grey-light-2&quot;,&quot;button&quot;:&quot;grey-light-2&quot;,&quot;button-border&quot;:&quot;grey-dark-1&quot;,&quot;menu-text&quot;:&quot;grey-dark-1&quot;,&quot;menu-link&quot;:&quot;grey-dark-2&quot;,&quot;line&quot;:&quot;grey-dark-1&quot;,&quot;image-border&quot;:&quot;white&quot;,&quot;rectangle&quot;:&quot;grey-light-1&quot;,&quot;group-filled&quot;:&quot;white&quot;,&quot;border&quot;:&quot;grey&quot;,&quot;link&quot;:&quot;grey-dark-3&quot;,&quot;metadata&quot;:&quot;grey-dark-1&quot;,&quot;cell-border-filled&quot;:&quot;grey&quot;,&quot;coloring-tags&quot;:&quot;text-image, box-image, grid-section, board-sheet, grid-sheet, rectangle-border&quot;,&quot;type&quot;:&quot;colored&quot;,&quot;form-input-border&quot;:&quot;grey&quot;}\" id=\"sec-2c0c\">\n  <div class=\"u-clearfix u-sheet u-block-2f14-2\">\n    <nav class=\"u-align-left u-menu u-menu-dropdown u-nav-spacing-25 u-block-2f14-3\">\n      \n    <div class=\"menu-collapse\"><a class=\"u-btn-text u-button-style u-nav-link u-text-black\" href=\"#\"><svg class=\"u-svg-link\" viewBox=\"0 0 24 24\"><use xlink:href=\"#menu-hamburger\"></use></svg><svg class=\"u-svg-content\" version=\"1.1\" id=\"menu-hamburger\" viewBox=\"0 0 16 16\" x=\"0px\" y=\"0px\" xmlns:xlink=\"http://www.w3.org/1999/xlink\" xmlns=\"http://www.w3.org/2000/svg\">    <g>        <rect y=\"1\" width=\"16\" height=\"2\"></rect>        <rect y=\"7\" width=\"16\" height=\"2\"></rect>        <rect y=\"13\" width=\"16\" height=\"2\"></rect>    </g></svg></a></div><div class=\"u-nav-container\"><ul class=\"u-nav u-unstyled u-block-2f14-4\">\n        \n        \n        \n        \n        \n        \n        \n        \n      <li class=\"u-nav-item\">\n          <a class=\"u-btn-text u-button-style u-nav-link u-text-black\" href=\"/home.html\" style=\"padding: 1px 34.4296px 2px 34px;\" data-page-id=\"1436431\">home</a>\n        <div class=\"fake u-hidden u-nav-popup\">               <ul class=\"u-nav u-unstyled u-block-2f14-5\"><li class=\"u-nav-item\"><a class=\"u-button-style u-nav-link\">Menu Item 1</a></li><li class=\"u-nav-item\"><a class=\"u-button-style u-nav-link\">Menu Item 2</a></li><li class=\"u-nav-item\"><a class=\"u-button-style u-nav-link\">Menu Item 3</a></li>               </ul>           </div></li></ul></div><div class=\"u-nav-container-collapse\"><div class=\"u-container-style u-inner-container-layout u-sidenav u-block-2f14-6\"><div class=\"u-inner-container-layout u-sidenav-overflow\"><ul class=\"u-align-center u-nav u-popupmenu-items u-unstyled u-block-2f14-7\"><div class=\"u-menu-close u-block-2f14-8\"></div>\n        \n        \n        \n        \n        \n        \n        \n        \n      <li class=\"u-nav-item\">\n          <a class=\"u-btn-text u-button-style u-nav-link u-text-black\" href=\"/home.html\" style=\"padding: 1px 34.4296px 2px 34px;\" data-page-id=\"1436431\">home</a>\n        </li></ul></div></div><div class=\"u-black u-menu-overlay u-opacity u-opacity-70\"></div></div></nav>\n  </div>\n  <style data-mode=\"XL\">@media (min-width: 1200px){ .u-block-2f14-2 {min-height: 60px}\n.u-block-2f14-3 {font-family: size-14; margin-top: 19.5px; margin-bottom: 19.5px; margin-left: auto; margin-right: auto} }</style>\n  <style data-mode=\"MD\">@media (max-width: 991px) and (min-width: 768px){ .u-block-2f14-2 {min-height: 60px}\n.u-block-2f14-3 {position: relative; margin-top: 19.5px; margin-bottom: 19.5px; margin-left: auto; margin-right: auto; font-family: size-14} }</style>\n  <style data-mode=\"SM\">@media (max-width: 767px) and (min-width: 576px){ .u-block-2f14-2 {min-height: 60px}\n.u-block-2f14-3 {position: relative; margin-top: 19.5px; margin-bottom: 19.5px; margin-left: auto; margin-right: auto; font-family: size-14} }</style>\n  <style data-mode=\"XS\">@media (max-width: 575px){ .u-block-2f14-2 {min-height: 60px}\n.u-block-2f14-3 {position: relative; margin-top: 19.5px; margin-bottom: 19.5px; margin-left: auto; margin-right: auto; font-family: size-14} }</style>\n  <style data-mode=\"LG\">@media (max-width: 1199px) and (min-width: 992px){ .u-block-2f14-2 {min-height: 60px}\n.u-block-2f14-3 {position: relative; margin-top: 19.5px; margin-bottom: 19.5px; margin-left: auto; margin-right: auto; font-family: size-14} }</style>\n</section>","footerHtml":"<section class=\"u-clearfix u-footer u-palette-4-base u-typography-Normal--Footer u-block-45c7-1\" custom-posts-hash=\"[T,T,T]\" data-style=\"footer-3-cols\" data-post-id=\"2584219693;2584219693;2584219693\" data-section-properties=\"{&quot;grid-spacing&quot;:&quot;30&quot;,&quot;align&quot;:&quot;center&quot;,&quot;stretch&quot;:true}\" data-id=\"45c7\" color-allocation=\"{&quot;name&quot;:&quot;footer-section-1&quot;,&quot;section&quot;:&quot;grey-dark-2&quot;,&quot;cell-filled&quot;:&quot;grey-dark-3&quot;,&quot;button&quot;:&quot;white&quot;,&quot;button-border&quot;:&quot;white&quot;,&quot;menu-text&quot;:&quot;white&quot;,&quot;menu-link&quot;:&quot;white&quot;,&quot;line&quot;:&quot;white&quot;,&quot;image-border&quot;:&quot;grey-dark-3&quot;,&quot;rectangle&quot;:&quot;grey-dark-1&quot;,&quot;group-filled&quot;:&quot;grey-dark-1&quot;,&quot;border&quot;:&quot;white&quot;,&quot;cell-border-filled&quot;:&quot;white&quot;,&quot;link&quot;:&quot;grey-light-1&quot;,&quot;metadata&quot;:&quot;&quot;,&quot;coloring-tags&quot;:&quot;box-image, grid-section, board-sheet, grid-sheet, rectangle-border&quot;,&quot;type&quot;:&quot;dark&quot;,&quot;form-input-border&quot;:&quot;grey&quot;}\" id=\"sec-5730\">\n  <div class=\"u-clearfix u-sheet u-block-45c7-2\">\n    <div class=\"u-clearfix u-disable-padding u-expanded-width u-gutter-30 u-layout-wrap u-block-45c7-3\">\n      <div class=\"u-gutter-0 u-layout\">\n        <div class=\"u-layout-row\">\n          <div class=\"u-align-left u-container-style u-layout-cell u-left-cell u-similar-fill u-size-20 u-size-20-md u-block-45c7-4\" data-behind-elements=\"[{':section':0}]\">\n            <div class=\"u-container-layout u-valign-top-md u-valign-top-sm u-valign-top-xl u-valign-top-xs u-block-45c7-5\">\n              \n              \n            <h3 class=\"u-expanded-width-lg u-text u-block-45c7-6\">About</h3><p class=\"u-expanded-width-lg u-text u-block-45c7-7\">It has survived not only five centuries, but also the leap into electronic typesetting, remaining essentially unchanged.</p></div>\n          </div>\n          <div class=\"u-align-left u-container-style u-layout-cell u-similar-fill u-size-20 u-size-20-md u-block-45c7-8\" data-behind-elements=\"[{':section':0}]\">\n            <div class=\"u-container-layout u-valign-top u-block-45c7-9\">\n              <h3 class=\"u-text u-block-45c7-10\">Headline</h3>\n              <p class=\"u-align-left u-text u-block-45c7-11\" data-modified-align=\"true\">Sample footer text</p><p class=\"u-align-left-md u-align-left-sm u-align-left-xl u-align-left-xs u-expanded-width u-text u-block-45c7-12\">Sample footer text</p><p class=\"u-expanded-width u-text u-block-45c7-13\">Sample footer text</p>\n            </div>\n          </div>\n          <div class=\"u-align-left u-container-style u-layout-cell u-right-cell u-similar-fill u-size-20 u-size-20-md u-block-45c7-14\" data-behind-elements=\"[{':section':0}]\">\n            <div class=\"u-container-layout u-block-45c7-15\">\n              <h3 class=\"u-expanded-width u-text u-block-45c7-16\">Headline</h3>\n              <p class=\"u-expanded-width u-text u-block-45c7-17\">Sample footer text</p><p class=\"u-expanded-width u-text u-block-45c7-18\" data-modified-align=\"true\">Sample footer text</p><p class=\"u-expanded-width u-text u-block-45c7-19\">Sample footer text</p>\n            </div>\n          </div>\n        </div>\n      </div>\n    </div>\n  </div>\n  <style data-mode=\"XL\">@media (min-width: 1200px){ .u-block-45c7-2 {min-height: 403px}\n.u-block-45c7-3 {margin-top: 93px; margin-right: auto; margin-bottom: 93px; margin-left: 0px}\n.u-block-45c7-4 {min-height: 247px}\n.u-block-45c7-6 {margin-top: 20px; margin-right: 236.359px; margin-bottom: 0px; margin-left: 0px}\n.u-block-45c7-7 {margin-top: 20px; margin-right: 30px; margin-bottom: 20px; margin-left: 0px}\n.u-block-45c7-8 {min-height: 247px}\n.u-block-45c7-10 {margin-top: 20px; margin-left: 0px; margin-right: 0px; margin-bottom: 0px}\n.u-block-45c7-11 {margin-top: 20px; margin-bottom: 20px; margin-left: 0px; margin-right: 0px}\n.u-block-45c7-12 {margin-top: 20px; margin-bottom: 20px; margin-left: 0px; margin-right: 0px}\n.u-block-45c7-13 {margin-top: 20px; margin-bottom: 20px; margin-left: 0px; margin-right: 0px}\n.u-block-45c7-14 {min-height: 247px; background-position: 0% 0%}\n.u-block-45c7-15 {padding-left: 0px; padding-right: 0px}\n.u-block-45c7-16 {margin-top: 20px; margin-left: 0px; margin-right: 0px; margin-bottom: 0px}\n.u-block-45c7-17 {margin-top: 20px; margin-bottom: 20px; margin-left: 0px; margin-right: 0px}\n.u-block-45c7-18 {margin-top: 20px; margin-bottom: 20px; margin-left: 0px; margin-right: 0px}\n.u-block-45c7-19 {margin-top: 20px; margin-bottom: 20px; margin-left: 0px; margin-right: 0px} }</style>\n  <style data-mode=\"MD\">@media (max-width: 991px) and (min-width: 768px){ .u-block-45c7-2 {min-height: 403px}\n.u-block-45c7-3 {position: relative; margin-top: 93px; margin-bottom: 93px}\n.u-block-45c7-4 {min-height: 247px}\n.u-block-45c7-6 {margin-top: 20px; margin-right: 15px; margin-bottom: 0px; margin-left: -15px; position: relative}\n.u-block-45c7-7 {margin-top: 10px; margin-right: 15px; margin-bottom: 20px; margin-left: -15px; position: relative}\n.u-block-45c7-8 {min-height: 247px}\n.u-block-45c7-10 {margin-top: 20px; margin-bottom: 0px; position: relative; margin-left: 0px; margin-right: 0px}\n.u-block-45c7-11 {margin-top: 10px; margin-bottom: 20px; position: relative; margin-left: 0px; margin-right: 0px}\n.u-block-45c7-12 {margin-top: 20px; margin-bottom: 0px; position: relative}\n.u-block-45c7-13 {margin-top: 20px; margin-bottom: 20px; position: relative}\n.u-block-45c7-14 {min-height: 247px; background-position: 0% 0%}\n.u-block-45c7-15 {padding-left: 0px; padding-right: 0px}\n.u-block-45c7-16 {margin-top: 20px; margin-bottom: 0px; position: relative}\n.u-block-45c7-17 {margin-top: 10px; margin-bottom: 20px; position: relative}\n.u-block-45c7-18 {margin-top: 10px; margin-bottom: 20px; position: relative}\n.u-block-45c7-19 {margin-top: 10px; margin-bottom: 20px; position: relative} }</style>\n  <style data-mode=\"SM\">@media (max-width: 767px) and (min-width: 576px){ .u-block-45c7-2 {min-height: 403px}\n.u-block-45c7-3 {position: relative; margin-top: 93px; margin-bottom: 93px}\n.u-block-45c7-4 {min-height: 247px}\n.u-block-45c7-6 {margin-top: 20px; margin-left: 0px; margin-right: 0px; margin-bottom: 0px; position: relative}\n.u-block-45c7-7 {margin-top: 10px; margin-left: 0px; margin-right: 0px; margin-bottom: 20px; position: relative}\n.u-block-45c7-8 {min-height: 247px}\n.u-block-45c7-10 {margin-top: 5px; margin-bottom: 0px; position: relative; margin-left: 0px; margin-right: 0px}\n.u-block-45c7-11 {margin-top: 10px; margin-bottom: 20px; position: relative; margin-left: 0px; margin-right: 0px}\n.u-block-45c7-12 {margin-top: 20px; margin-bottom: 0px; position: relative}\n.u-block-45c7-13 {margin-top: 20px; margin-bottom: 20px; position: relative}\n.u-block-45c7-14 {min-height: 247px; background-position: 0% 0%}\n.u-block-45c7-15 {padding-left: 0px; padding-right: 0px}\n.u-block-45c7-16 {margin-top: 5px; margin-bottom: 0px; position: relative}\n.u-block-45c7-17 {margin-top: 10px; margin-bottom: 20px; position: relative}\n.u-block-45c7-18 {margin-top: 10px; margin-bottom: 20px; position: relative}\n.u-block-45c7-19 {margin-top: 10px; margin-bottom: 20px; position: relative} }</style>\n  <style data-mode=\"XS\">@media (max-width: 575px){ .u-block-45c7-2 {min-height: 403px}\n.u-block-45c7-3 {position: relative; margin-top: 93px; margin-bottom: 93px}\n.u-block-45c7-4 {min-height: 247px}\n.u-block-45c7-6 {margin-top: 20px; margin-right: 10px; margin-bottom: 0px; margin-left: -10px; position: relative}\n.u-block-45c7-7 {margin-top: 10px; margin-right: 10px; margin-bottom: 20px; margin-left: -10px; position: relative}\n.u-block-45c7-8 {min-height: 247px}\n.u-block-45c7-10 {margin-top: 10px; margin-bottom: 0px; position: relative; margin-left: 0px; margin-right: 0px}\n.u-block-45c7-11 {margin-top: 10px; margin-bottom: 20px; position: relative; margin-left: 0px; margin-right: 0px}\n.u-block-45c7-12 {margin-top: 20px; margin-bottom: 0px; position: relative}\n.u-block-45c7-13 {margin-top: 20px; margin-bottom: 20px; position: relative}\n.u-block-45c7-14 {min-height: 247px; background-position: 0% 0%}\n.u-block-45c7-15 {padding-left: 0px; padding-right: 0px}\n.u-block-45c7-16 {margin-top: 10px; margin-bottom: 0px; position: relative}\n.u-block-45c7-17 {margin-top: 10px; margin-bottom: 20px; position: relative}\n.u-block-45c7-18 {margin-top: 10px; margin-bottom: 20px; position: relative}\n.u-block-45c7-19 {margin-top: 10px; margin-bottom: 20px; position: relative} }</style>\n  <style data-mode=\"LG\">@media (max-width: 1199px) and (min-width: 992px){ .u-block-45c7-2 {min-height: 403px}\n.u-block-45c7-3 {position: relative; margin-top: 93px; margin-bottom: 93px}\n.u-block-45c7-4 {min-height: 247px}\n.u-block-45c7-6 {position: relative; margin-top: 20px; margin-bottom: 0px}\n.u-block-45c7-7 {position: relative; margin-top: 10px; margin-bottom: 20px}\n.u-block-45c7-8 {min-height: 247px}\n.u-block-45c7-10 {position: relative; margin-top: 20px; margin-left: 0px; margin-right: 0px; margin-bottom: 0px}\n.u-block-45c7-11 {margin-top: 10px; position: relative; margin-left: 0px; margin-right: 0px; margin-bottom: 20px}\n.u-block-45c7-12 {position: relative; margin-top: 20px; margin-bottom: 0px}\n.u-block-45c7-13 {position: relative; margin-top: 20px; margin-bottom: 20px}\n.u-block-45c7-14 {min-height: 247px; background-position: 0% 0%}\n.u-block-45c7-15 {padding-left: 0px; padding-right: 0px}\n.u-block-45c7-16 {margin-top: 20px; margin-bottom: 0px; position: relative}\n.u-block-45c7-17 {margin-top: 10px; margin-bottom: 20px; position: relative}\n.u-block-45c7-18 {margin-top: 10px; margin-bottom: 20px; position: relative}\n.u-block-45c7-19 {margin-top: 10px; margin-bottom: 20px; position: relative} }</style>\n</section>","hideBacklink":null,"homePageId":1436431,"dateUpdated":1645020438897,"settings":"{\"id\":0,\"colorScheme\":{\"bodyColors\":[\"#111111\",\"#ffffff\"],\"bgColor\":\"#ffffff\",\"colors\":[\"#f07b0d\",\"#3dd2ae\",\"#232831\",\"#2b303b\",\"#b8c1cc\"],\"shadingContrast\":\"body-alt-color\",\"whiteContrast\":\"body-color\",\"bgContrast\":\"body-color\",\"name\":\"u11\",\"customColors\":[]},\"fontScheme\":{\"name\":\"Roboto-OpenSans\",\"default\":true,\"isDefault\":true,\"fonts\":{\"heading\":\"Roboto, sans-serif\",\"text\":\"Open Sans, sans-serif\",\"accent\":\"Arial, sans-serif\",\"headingTitle\":\"Roboto\",\"textTitle\":\"Open Sans\"}},\"typography\":{\"name\":\"Normal\",\"isDefault\":true,\"title\":{\"font-weight\":\"400\",\"font-size\":4.5,\"line-height\":\"1_1\",\"margin-top\":20,\"margin-bottom\":20,\"SM\":{\"font-size\":3.75},\"XS\":{\"font-size\":3}},\"subtitle\":{\"font-weight\":\"400\",\"font-size\":2.25,\"line-height\":\"1_1\",\"margin-top\":20,\"margin-bottom\":20,\"XS\":{\"font-size\":1.5}},\"h1\":{\"font-weight\":\"400\",\"font-size\":3,\"line-height\":\"1_1\",\"margin-top\":20,\"margin-bottom\":20,\"XS\":{\"font-size\":1.875}},\"h2\":{\"font-weight\":\"400\",\"font-size\":2.25,\"line-height\":\"1_1\",\"margin-top\":20,\"margin-bottom\":20,\"XS\":{\"font-size\":1.5}},\"h3\":{\"font-weight\":\"400\",\"font-size\":1.875,\"line-height\":\"1_2\",\"margin-top\":20,\"margin-bottom\":20,\"XS\":{\"font-size\":1.5}},\"h4\":{\"font-weight\":\"400\",\"font-size\":1.5,\"line-height\":\"1_2\",\"margin-top\":20,\"margin-bottom\":20},\"h5\":{\"font-weight\":\"400\",\"font-size\":1.25,\"line-height\":\"1_2\",\"margin-top\":20,\"margin-bottom\":20},\"h6\":{\"font-weight\":\"400\",\"font-size\":1.125,\"line-height\":\"1_2\",\"margin-top\":20,\"margin-bottom\":20},\"largeText\":{\"font-size\":1.25,\"margin-top\":20,\"margin-bottom\":20},\"smallText\":{\"font-size\":0.875,\"margin-top\":20,\"margin-bottom\":20},\"text\":{\"margin-top\":20,\"margin-bottom\":20},\"hyperlink\":{\"text-color\":\"palette-1-base\"},\"link\":{},\"button\":{\"color\":\"palette-1-base\",\"margin-top\":20,\"margin-bottom\":20},\"blockquote\":{\"font-style\":\"italic\",\"indent\":20,\"border\":4,\"border-color\":\"palette-1-base\",\"margin-top\":20,\"margin-bottom\":20},\"metadata\":{\"margin-top\":20,\"margin-bottom\":20},\"list\":{\"margin-top\":20,\"margin-bottom\":20},\"orderedlist\":{\"margin-top\":20,\"margin-bottom\":20},\"postContent\":{\"margin-top\":20,\"margin-bottom\":20},\"theme\":{\"gradient\":\"\",\"image\":\"\",\"sheet-width-xl\":1140,\"sheet-width-lg\":940,\"sheet-width-md\":720,\"sheet-width-sm\":540,\"sheet-width-xs\":340},\"htmlBaseSize\":16},\"backToTop\":\"<span style=\\\"height: 64px; width: 64px; margin-left: 0px; margin-right: auto; margin-top: 0px; background-image: none; right: 20px; bottom: 20px\\\" class=\\\"u-back-to-top u-icon u-icon-circle u-opacity u-opacity-85 u-palette-1-base u-spacing-15\\\" data-href=\\\"#\\\">\\n        <svg class=\\\"u-svg-link\\\" preserveAspectRatio=\\\"xMidYMin slice\\\" viewBox=\\\"0 0 551.13 551.13\\\">\\n            <use xmlns:xlink=\\\"http://www.w3.org/1999/xlink\\\" xlink:href=\\\"#svg-1d98\\\"></use>\\n        </svg>\\n        <svg class=\\\"u-svg-content\\\" enable-background=\\\"new 0 0 551.13 551.13\\\" viewBox=\\\"0 0 551.13 551.13\\\" xmlns=\\\"http://www.w3.org/2000/svg\\\" id=\\\"svg-1d98\\\">\\n            <path d=\\\"m275.565 189.451 223.897 223.897h51.668l-275.565-275.565-275.565 275.565h51.668z\\\"></path>\\n        </svg>\\n    </span>\",\"cookiesSection\":\"<section class=\\\"u-align-center u-block-7a8a-1 u-clearfix u-cookies-consent u-grey-80\\\" custom-posts-hash=\\\"T\\\" style=\\\"background-image: none\\\" data-post-id=\\\"1\\\" data-section-properties=\\\"{&quot;stretch&quot;:true}\\\" data-id=\\\"7a8a\\\" data-posts-content=\\\"[{'images':[],'maps':[],'videos':[],'icons':[],'textWidth':874,'textHeight':152,'id':1,'headingProp':'h3','textProp':'text'}]\\\" data-style=\\\"cookie-1\\\" id=\\\"sec-7caf\\\" data-source=\\\"\\\">\\n  <div class=\\\"u-block-7a8a-2 u-clearfix u-sheet u-valign-middle\\\" style=\\\"min-height: 212px\\\" data-height-lg=\\\"158\\\" data-height-md=\\\"131\\\" data-height-sm=\\\"106\\\" data-height-xs=\\\"225\\\">\\n    <div class=\\\"u-block-7a8a-7 u-clearfix u-expanded-width u-layout-wrap\\\" style=\\\"margin-top: 30px; margin-bottom: 30px\\\">\\n      <div class=\\\"u-gutter-0 u-layout\\\">\\n        <div class=\\\"u-layout-row\\\">\\n          <div class=\\\"u-block-7a8a-8 u-container-style u-layout-cell u-left-cell u-size-43-md u-size-43-sm u-size-43-xs u-size-46-lg u-size-46-xl\\\" style=\\\"min-height: 152px\\\">\\n            <div class=\\\"u-block-7a8a-9 u-container-layout u-valign-middle\\\" style=\\\"padding-top: 30px; padding-bottom: 30px; padding-left: 60px; padding-right: 60px\\\">\\n              <h3 class=\\\"u-block-7a8a-6 u-text u-text-default\\\" style=\\\"margin-top: 0px; margin-right: 20px; margin-bottom: 0px\\\">Cookies &amp; Privacy</h3>\\n              <p class=\\\"u-block-7a8a-5 u-text\\\" style=\\\"margin: 8px 158.328px 0px 0px;\\\">This website uses cookies to ensure you get the best experience on our website.</p>\\n            </div>\\n          </div>\\n          <div class=\\\"u-align-left u-block-7a8a-10 u-container-style u-layout-cell u-right-cell u-size-14-lg u-size-14-xl u-size-17-md u-size-17-sm u-size-17-xs\\\" style=\\\"min-height: 152px\\\">\\n            <div class=\\\"u-block-7a8a-11 u-container-layout u-valign-middle-lg u-valign-middle-md u-valign-middle-xl u-valign-top-sm u-valign-top-xs\\\" style=\\\"padding-top: 30px; padding-bottom: 30px; padding-left: 30px; padding-right: 30px\\\">\\n              <a href=\\\"###\\\" class=\\\"u-block-7a8a-3 u-btn u-button-confirm u-button-style u-palette-1-base\\\" style=\\\"margin-top: 0px; margin-right: auto; margin-bottom: 0px; margin-left: 0px\\\">Confirm</a>\\n            </div>\\n          </div>\\n        </div>\\n      </div>\\n    </div>\\n  </div>\\n  <style data-mode=\\\"XL\\\">@media (max-width: 0px) { .u-block-7a8a-1 {background-image: none}\\n.u-block-7a8a-2 {min-height: 212px}\\n.u-block-7a8a-7 {margin-top: 30px; margin-bottom: 30px}\\n.u-block-7a8a-8 {min-height: 152px}\\n.u-block-7a8a-9 {padding-top: 30px; padding-bottom: 30px; padding-left: 60px; padding-right: 60px}\\n.u-block-7a8a-6 {margin-top: 0px; margin-right: 20px; margin-bottom: 0px}\\n.u-block-7a8a-5 {margin-top: 8px; margin-right: 158.328px; margin-bottom: 0px; margin-left: 0px}\\n.u-block-7a8a-10 {min-height: 152px}\\n.u-block-7a8a-11 {padding-top: 30px; padding-bottom: 30px; padding-left: 30px; padding-right: 30px}\\n.u-block-7a8a-3 {margin-top: 0px; margin-right: auto; margin-bottom: 0px; margin-left: 0px} }</style>\\n  <style data-mode=\\\"LG\\\">@media (max-width: 0px) { .u-block-7a8a-1 {background-image: none}\\n.u-block-7a8a-2 {min-height: 131px}\\n.u-block-7a8a-7 {margin-top: 30px; margin-bottom: 30px}\\n.u-block-7a8a-8 {min-height: 125px}\\n.u-block-7a8a-9 {padding-top: 30px; padding-bottom: 30px; padding-left: 60px; padding-right: 60px}\\n.u-block-7a8a-6 {margin-top: 0px; margin-right: 0px; margin-bottom: 0px}\\n.u-block-7a8a-5 {margin-top: 8px; margin-right: 5px; margin-bottom: 0px; margin-left: 0px}\\n.u-block-7a8a-10 {min-height: 125px}\\n.u-block-7a8a-11 {padding-top: 30px; padding-bottom: 30px; padding-left: 30px; padding-right: 30px}\\n.u-block-7a8a-3 {margin-top: 0px; margin-right: auto; margin-bottom: 0px; margin-left: 0px} }</style>\\n  <style data-mode=\\\"MD\\\" data-visited=\\\"true\\\">@media (max-width: 0px) { .u-block-7a8a-1 {background-image: none}\\n.u-block-7a8a-2 {min-height: 106px}\\n.u-block-7a8a-7 {margin-top: 30px; margin-bottom: 30px}\\n.u-block-7a8a-8 {min-height: 100px}\\n.u-block-7a8a-9 {padding-top: 30px; padding-bottom: 30px; padding-left: 30px; padding-right: 30px}\\n.u-block-7a8a-6 {margin-top: 0px; margin-right: 0px; margin-bottom: 0px}\\n.u-block-7a8a-5 {margin-top: 8px; margin-right: 0px; margin-bottom: 0px; margin-left: 0px}\\n.u-block-7a8a-10 {min-height: 100px}\\n.u-block-7a8a-11 {padding-top: 30px; padding-bottom: 30px; padding-left: 30px; padding-right: 30px}\\n.u-block-7a8a-3 {margin-top: 0px; margin-right: auto; margin-bottom: 0px; margin-left: 0px} }</style>\\n  <style data-mode=\\\"SM\\\" data-visited=\\\"true\\\">@media (max-width: 0px) { .u-block-7a8a-1 {background-image: none}\\n.u-block-7a8a-2 {min-height: 225px}\\n.u-block-7a8a-7 {margin-top: 30px; margin-bottom: 30px}\\n.u-block-7a8a-8 {min-height: 154px}\\n.u-block-7a8a-9 {padding-top: 30px; padding-left: 10px; padding-right: 10px; padding-bottom: 20px}\\n.u-block-7a8a-6 {margin-top: 0px; margin-right: 0px; margin-bottom: 0px}\\n.u-block-7a8a-5 {margin-top: 8px; margin-right: 0px; margin-bottom: 0px; margin-left: 0px}\\n.u-block-7a8a-10 {min-height: 65px}\\n.u-block-7a8a-11 {padding-top: 10px; padding-bottom: 10px; padding-left: 10px; padding-right: 10px}\\n.u-block-7a8a-3 {margin-top: 0px; margin-right: auto; margin-bottom: 0px; margin-left: 0px} }</style>\\n  <style data-mode=\\\"XS\\\" data-visited=\\\"true\\\">@media (max-width: 0px) { .u-block-7a8a-1 {background-image: none}\\n.u-block-7a8a-2 {min-height: 121px}\\n.u-block-7a8a-7 {margin-top: 30px; margin-bottom: 30px}\\n.u-block-7a8a-8 {min-height: 100px}\\n.u-block-7a8a-9 {padding-top: 30px; padding-bottom: 20px; padding-left: 10px; padding-right: 10px}\\n.u-block-7a8a-6 {margin-top: 0px; margin-right: 0px; margin-bottom: 0px}\\n.u-block-7a8a-5 {margin-top: 8px; margin-right: 0px; margin-bottom: 0px; margin-left: 0px}\\n.u-block-7a8a-10 {min-height: 15px}\\n.u-block-7a8a-11 {padding-top: 10px; padding-bottom: 10px; padding-left: 10px; padding-right: 10px}\\n.u-block-7a8a-3 {margin-top: 0px; margin-right: auto; margin-bottom: 0px; margin-left: 0px} }</style>\\n</section>\",\"themeBackLinks\":\"\",\"blog\":\"{\\\"posts\\\":{\\\"items\\\":[]}}\",\"publishNicePageCss\":null,\"domain\":\"\"}","dialog":null,"title":"WebSite1436430","siteStyleCss":"<style id=\"color-scheme\" color-scheme=\"u11\" color-style=\"multicolor-1\">.u-body {\n--none: transparent;\n--none-darker: transparent;\n--none-r: 255;\n--none-g: 255;\n--none-b: 255;\n--none-contrast: body-color;\n--none-contrast-darker: body-color;\n--none-text-color: var(--body-color);\n--transparent: transparent;\n--transparent-darker: transparent;\n--transparent-r: 255;\n--transparent-g: 255;\n--transparent-b: 255;\n--transparent-contrast: body-color;\n--transparent-contrast-darker: body-color;\n--transparent-text-color: var(--body-color);\n--body-color: #111111;\n--body-color-darker: #0f0f0f;\n--body-color-r: 17;\n--body-color-g: 17;\n--body-color-b: 17;\n--body-color-contrast: white;\n--body-color-contrast-darker: white;\n--body-color-text-color: var(--body-alt-color);\n--body-alt-color: #ffffff;\n--body-alt-color-darker: #e6e6e6;\n--body-alt-color-r: 255;\n--body-alt-color-g: 255;\n--body-alt-color-b: 255;\n--body-alt-color-contrast: black;\n--body-alt-color-contrast-darker: black;\n--body-alt-color-text-color: var(--body-color);\n--bg-color: #ffffff;\n--bg-color-darker: #e6e6e6;\n--bg-color-r: 255;\n--bg-color-g: 255;\n--bg-color-b: 255;\n--bg-color-contrast: black;\n--bg-color-contrast-darker: black;\n--bg-color-text-color: var(--body-color);\n--palette-1-base: #f07b0d;\n--palette-1-base-darker: #d86f0c;\n--palette-1-base-r: 240;\n--palette-1-base-g: 123;\n--palette-1-base-b: 13;\n--palette-1-base-contrast: white;\n--palette-1-base-contrast-darker: white;\n--palette-1-base-text-color: var(--body-alt-color);\n--palette-1-dark-3: #332e29;\n--palette-1-dark-3-darker: #2e2925;\n--palette-1-dark-3-r: 51;\n--palette-1-dark-3-g: 46;\n--palette-1-dark-3-b: 41;\n--palette-1-dark-3-contrast: white;\n--palette-1-dark-3-contrast-darker: white;\n--palette-1-dark-3-text-color: var(--body-alt-color);\n--palette-1-dark-2: #72583f;\n--palette-1-dark-2-darker: #674f39;\n--palette-1-dark-2-r: 114;\n--palette-1-dark-2-g: 88;\n--palette-1-dark-2-b: 63;\n--palette-1-dark-2-contrast: white;\n--palette-1-dark-2-contrast-darker: white;\n--palette-1-dark-2-text-color: var(--body-alt-color);\n--palette-1-dark-1: #b17136;\n--palette-1-dark-1-darker: #9f6631;\n--palette-1-dark-1-r: 177;\n--palette-1-dark-1-g: 113;\n--palette-1-dark-1-b: 54;\n--palette-1-dark-1-contrast: white;\n--palette-1-dark-1-contrast-darker: white;\n--palette-1-dark-1-text-color: var(--body-alt-color);\n--palette-1: #f07b0d;\n--palette-1-darker: #d86f0c;\n--palette-1-r: 240;\n--palette-1-g: 123;\n--palette-1-b: 13;\n--palette-1-contrast: white;\n--palette-1-contrast-darker: white;\n--palette-1-text-color: var(--body-alt-color);\n--palette-1-light-1: #f5a153;\n--palette-1-light-1-darker: #f39034;\n--palette-1-light-1-r: 245;\n--palette-1-light-1-g: 161;\n--palette-1-light-1-b: 83;\n--palette-1-light-1-contrast: white;\n--palette-1-light-1-contrast-darker: white;\n--palette-1-light-1-text-color: var(--body-alt-color);\n--palette-1-light-2: #f9c89b;\n--palette-1-light-2-darker: #f7b375;\n--palette-1-light-2-r: 249;\n--palette-1-light-2-g: 200;\n--palette-1-light-2-b: 155;\n--palette-1-light-2-contrast: black;\n--palette-1-light-2-contrast-darker: black;\n--palette-1-light-2-text-color: var(--body-color);\n--palette-1-light-3: #fef1e6;\n--palette-1-light-3-darker: #fcd7b7;\n--palette-1-light-3-r: 254;\n--palette-1-light-3-g: 241;\n--palette-1-light-3-b: 230;\n--palette-1-light-3-contrast: black;\n--palette-1-light-3-contrast-darker: black;\n--palette-1-light-3-text-color: var(--body-color);\n--palette-2-base: #3dd2ae;\n--palette-2-base-darker: #2ec6a1;\n--palette-2-base-r: 61;\n--palette-2-base-g: 210;\n--palette-2-base-b: 174;\n--palette-2-base-contrast: black;\n--palette-2-base-contrast-darker: white;\n--palette-2-base-text-color: var(--body-color);\n--palette-2-dark-3: #293331;\n--palette-2-dark-3-darker: #252e2c;\n--palette-2-dark-3-r: 41;\n--palette-2-dark-3-g: 51;\n--palette-2-dark-3-b: 49;\n--palette-2-dark-3-contrast: white;\n--palette-2-dark-3-contrast-darker: white;\n--palette-2-dark-3-text-color: var(--body-alt-color);\n--palette-2-dark-2: #42685f;\n--palette-2-dark-2-darker: #3b5e56;\n--palette-2-dark-2-r: 66;\n--palette-2-dark-2-g: 104;\n--palette-2-dark-2-b: 95;\n--palette-2-dark-2-contrast: white;\n--palette-2-dark-2-contrast-darker: white;\n--palette-2-dark-2-text-color: var(--body-alt-color);\n--palette-2-dark-1: #489d89;\n--palette-2-dark-1-darker: #418d7b;\n--palette-2-dark-1-r: 72;\n--palette-2-dark-1-g: 157;\n--palette-2-dark-1-b: 137;\n--palette-2-dark-1-contrast: white;\n--palette-2-dark-1-contrast-darker: white;\n--palette-2-dark-1-text-color: var(--body-alt-color);\n--palette-2: #3dd2ae;\n--palette-2-darker: #2ec6a1;\n--palette-2-r: 61;\n--palette-2-g: 210;\n--palette-2-b: 174;\n--palette-2-contrast: black;\n--palette-2-contrast-darker: white;\n--palette-2-text-color: var(--body-color);\n--palette-2-light-1: #70e0c5;\n--palette-2-light-1-darker: #54daba;\n--palette-2-light-1-r: 112;\n--palette-2-light-1-g: 224;\n--palette-2-light-1-b: 197;\n--palette-2-light-1-contrast: black;\n--palette-2-light-1-contrast-darker: black;\n--palette-2-light-1-text-color: var(--body-color);\n--palette-2-light-2: #aaeddd;\n--palette-2-light-2-darker: #88e6d0;\n--palette-2-light-2-r: 170;\n--palette-2-light-2-g: 237;\n--palette-2-light-2-b: 221;\n--palette-2-light-2-contrast: black;\n--palette-2-light-2-contrast-darker: black;\n--palette-2-light-2-text-color: var(--body-color);\n--palette-2-light-3: #e9fbf6;\n--palette-2-light-3-darker: #c0f4e5;\n--palette-2-light-3-r: 233;\n--palette-2-light-3-g: 251;\n--palette-2-light-3-b: 246;\n--palette-2-light-3-contrast: black;\n--palette-2-light-3-contrast-darker: black;\n--palette-2-light-3-text-color: var(--body-color);\n--palette-3-base: #232831;\n--palette-3-base-darker: #20242c;\n--palette-3-base-r: 35;\n--palette-3-base-g: 40;\n--palette-3-base-b: 49;\n--palette-3-base-contrast: white;\n--palette-3-base-contrast-darker: white;\n--palette-3-base-text-color: var(--body-alt-color);\n--palette-3-dark-3: #292c33;\n--palette-3-dark-3-darker: #25282e;\n--palette-3-dark-3-r: 41;\n--palette-3-dark-3-g: 44;\n--palette-3-dark-3-b: 51;\n--palette-3-dark-3-contrast: white;\n--palette-3-dark-3-contrast-darker: white;\n--palette-3-dark-3-text-color: var(--body-alt-color);\n--palette-3-dark-2: #464e5b;\n--palette-3-dark-2-darker: #3f4652;\n--palette-3-dark-2-r: 70;\n--palette-3-dark-2-g: 78;\n--palette-3-dark-2-b: 91;\n--palette-3-dark-2-contrast: white;\n--palette-3-dark-2-contrast-darker: white;\n--palette-3-dark-2-text-color: var(--body-alt-color);\n--palette-3-dark-1: #6f7786;\n--palette-3-dark-1-darker: #646b79;\n--palette-3-dark-1-r: 111;\n--palette-3-dark-1-g: 119;\n--palette-3-dark-1-b: 134;\n--palette-3-dark-1-contrast: white;\n--palette-3-dark-1-contrast-darker: white;\n--palette-3-dark-1-text-color: var(--body-alt-color);\n--palette-3: #9ca3b0;\n--palette-3-darker: #8a92a1;\n--palette-3-r: 156;\n--palette-3-g: 163;\n--palette-3-b: 176;\n--palette-3-contrast: white;\n--palette-3-contrast-darker: white;\n--palette-3-text-color: var(--body-alt-color);\n--palette-3-light-1: #b8bdc8;\n--palette-3-light-1-darker: #a2a9b7;\n--palette-3-light-1-r: 184;\n--palette-3-light-1-g: 189;\n--palette-3-light-1-b: 200;\n--palette-3-light-1-contrast: black;\n--palette-3-light-1-contrast-darker: white;\n--palette-3-light-1-text-color: var(--body-color);\n--palette-3-light-2: #d5d9df;\n--palette-3-light-2-darker: #bcc3cc;\n--palette-3-light-2-r: 213;\n--palette-3-light-2-g: 217;\n--palette-3-light-2-b: 223;\n--palette-3-light-2-contrast: black;\n--palette-3-light-2-contrast-darker: black;\n--palette-3-light-2-text-color: var(--body-color);\n--palette-3-light-3: #f4f5f7;\n--palette-3-light-3-darker: #d8dbe2;\n--palette-3-light-3-r: 244;\n--palette-3-light-3-g: 245;\n--palette-3-light-3-b: 247;\n--palette-3-light-3-contrast: black;\n--palette-3-light-3-contrast-darker: black;\n--palette-3-light-3-text-color: var(--body-color);\n--palette-4-base: #2b303b;\n--palette-4-base-darker: #272b35;\n--palette-4-base-r: 43;\n--palette-4-base-g: 48;\n--palette-4-base-b: 59;\n--palette-4-base-contrast: white;\n--palette-4-base-contrast-darker: white;\n--palette-4-base-text-color: var(--body-alt-color);\n--palette-4-dark-3: #292c33;\n--palette-4-dark-3-darker: #25282e;\n--palette-4-dark-3-r: 41;\n--palette-4-dark-3-g: 44;\n--palette-4-dark-3-b: 51;\n--palette-4-dark-3-contrast: white;\n--palette-4-dark-3-contrast-darker: white;\n--palette-4-dark-3-text-color: var(--body-alt-color);\n--palette-4-dark-2: #4d5362;\n--palette-4-dark-2-darker: #454b58;\n--palette-4-dark-2-r: 77;\n--palette-4-dark-2-g: 83;\n--palette-4-dark-2-b: 98;\n--palette-4-dark-2-contrast: white;\n--palette-4-dark-2-contrast-darker: white;\n--palette-4-dark-2-text-color: var(--body-alt-color);\n--palette-4-dark-1: #727989;\n--palette-4-dark-1-darker: #676d7b;\n--palette-4-dark-1-r: 114;\n--palette-4-dark-1-g: 121;\n--palette-4-dark-1-b: 137;\n--palette-4-dark-1-contrast: white;\n--palette-4-dark-1-contrast-darker: white;\n--palette-4-dark-1-text-color: var(--body-alt-color);\n--palette-4: #9ca2b0;\n--palette-4-darker: #8a91a1;\n--palette-4-r: 156;\n--palette-4-g: 162;\n--palette-4-b: 176;\n--palette-4-contrast: white;\n--palette-4-contrast-darker: white;\n--palette-4-text-color: var(--body-alt-color);\n--palette-4-light-1: #b8bdc7;\n--palette-4-light-1-darker: #a3a9b6;\n--palette-4-light-1-r: 184;\n--palette-4-light-1-g: 189;\n--palette-4-light-1-b: 199;\n--palette-4-light-1-contrast: black;\n--palette-4-light-1-contrast-darker: white;\n--palette-4-light-1-text-color: var(--body-color);\n--palette-4-light-2: #d5d8df;\n--palette-4-light-2-darker: #bcc1cc;\n--palette-4-light-2-r: 213;\n--palette-4-light-2-g: 216;\n--palette-4-light-2-b: 223;\n--palette-4-light-2-contrast: black;\n--palette-4-light-2-contrast-darker: black;\n--palette-4-light-2-text-color: var(--body-color);\n--palette-4-light-3: #f4f5f7;\n--palette-4-light-3-darker: #d8dbe2;\n--palette-4-light-3-r: 244;\n--palette-4-light-3-g: 245;\n--palette-4-light-3-b: 247;\n--palette-4-light-3-contrast: black;\n--palette-4-light-3-contrast-darker: black;\n--palette-4-light-3-text-color: var(--body-color);\n--palette-5-base: #b8c1cc;\n--palette-5-base-darker: #a1adbc;\n--palette-5-base-r: 184;\n--palette-5-base-g: 193;\n--palette-5-base-b: 204;\n--palette-5-base-contrast: black;\n--palette-5-base-contrast-darker: white;\n--palette-5-base-text-color: var(--body-color);\n--palette-5-dark-3: #292d33;\n--palette-5-dark-3-darker: #25292e;\n--palette-5-dark-3-r: 41;\n--palette-5-dark-3-g: 45;\n--palette-5-dark-3-b: 51;\n--palette-5-dark-3-contrast: white;\n--palette-5-dark-3-contrast-darker: white;\n--palette-5-dark-3-text-color: var(--body-alt-color);\n--palette-5-dark-2: #555d66;\n--palette-5-dark-2-darker: #4d545c;\n--palette-5-dark-2-r: 85;\n--palette-5-dark-2-g: 93;\n--palette-5-dark-2-b: 102;\n--palette-5-dark-2-contrast: white;\n--palette-5-dark-2-contrast-darker: white;\n--palette-5-dark-2-text-color: var(--body-alt-color);\n--palette-5-dark-1: #858e99;\n--palette-5-dark-1-darker: #75808c;\n--palette-5-dark-1-r: 133;\n--palette-5-dark-1-g: 142;\n--palette-5-dark-1-b: 153;\n--palette-5-dark-1-contrast: white;\n--palette-5-dark-1-contrast-darker: white;\n--palette-5-dark-1-text-color: var(--body-alt-color);\n--palette-5: #b8c1cc;\n--palette-5-darker: #a1adbc;\n--palette-5-r: 184;\n--palette-5-g: 193;\n--palette-5-b: 204;\n--palette-5-contrast: black;\n--palette-5-contrast-darker: white;\n--palette-5-text-color: var(--body-color);\n--palette-5-light-1: #ccd3db;\n--palette-5-light-1-darker: #b3bec9;\n--palette-5-light-1-r: 204;\n--palette-5-light-1-g: 211;\n--palette-5-light-1-b: 219;\n--palette-5-light-1-contrast: black;\n--palette-5-light-1-contrast-darker: black;\n--palette-5-light-1-text-color: var(--body-color);\n--palette-5-light-2: #e0e5eb;\n--palette-5-light-2-darker: #c4ced9;\n--palette-5-light-2-r: 224;\n--palette-5-light-2-g: 229;\n--palette-5-light-2-b: 235;\n--palette-5-light-2-contrast: black;\n--palette-5-light-2-contrast-darker: black;\n--palette-5-light-2-text-color: var(--body-color);\n--palette-5-light-3: #f5f7fa;\n--palette-5-light-3-darker: #d4dde9;\n--palette-5-light-3-r: 245;\n--palette-5-light-3-g: 247;\n--palette-5-light-3-b: 250;\n--palette-5-light-3-contrast: black;\n--palette-5-light-3-contrast-darker: black;\n--palette-5-light-3-text-color: var(--body-color);\n--grey-40: #999999;\n--grey-40-darker: #8a8a8a;\n--grey-40-r: 153;\n--grey-40-g: 153;\n--grey-40-b: 153;\n--grey-40-contrast: white;\n--grey-40-contrast-darker: white;\n--grey-40-text-color: var(--body-alt-color);\n--grey-30: #b3b3b3;\n--grey-30-darker: #a1a1a1;\n--grey-30-r: 179;\n--grey-30-g: 179;\n--grey-30-b: 179;\n--grey-30-contrast: white;\n--grey-30-contrast-darker: white;\n--grey-30-text-color: var(--body-alt-color);\n--grey-25: #c0c0c0;\n--grey-25-darker: #adadad;\n--grey-25-r: 192;\n--grey-25-g: 192;\n--grey-25-b: 192;\n--grey-25-contrast: black;\n--grey-25-contrast-darker: white;\n--grey-25-text-color: var(--body-color);\n--white: #ffffff;\n--white-darker: #e6e6e6;\n--white-r: 255;\n--white-g: 255;\n--white-b: 255;\n--white-contrast: black;\n--white-contrast-darker: black;\n--white-text-color: var(--body-color);\n--grey-15: #d9d9d9;\n--grey-15-darker: #c3c3c3;\n--grey-15-r: 217;\n--grey-15-g: 217;\n--grey-15-b: 217;\n--grey-15-contrast: black;\n--grey-15-contrast-darker: black;\n--grey-15-text-color: var(--body-color);\n--grey-10: #e5e5e5;\n--grey-10-darker: #cecece;\n--grey-10-r: 229;\n--grey-10-g: 229;\n--grey-10-b: 229;\n--grey-10-contrast: black;\n--grey-10-contrast-darker: black;\n--grey-10-text-color: var(--body-color);\n--grey-5: #f2f2f2;\n--grey-5-darker: #dadada;\n--grey-5-r: 242;\n--grey-5-g: 242;\n--grey-5-b: 242;\n--grey-5-contrast: black;\n--grey-5-contrast-darker: black;\n--grey-5-text-color: var(--body-color);\n--grey-90: #1a1a1a;\n--grey-90-darker: #171717;\n--grey-90-r: 26;\n--grey-90-g: 26;\n--grey-90-b: 26;\n--grey-90-contrast: white;\n--grey-90-contrast-darker: white;\n--grey-90-text-color: var(--body-alt-color);\n--grey-80: #333333;\n--grey-80-darker: #2e2e2e;\n--grey-80-r: 51;\n--grey-80-g: 51;\n--grey-80-b: 51;\n--grey-80-contrast: white;\n--grey-80-contrast-darker: white;\n--grey-80-text-color: var(--body-alt-color);\n--grey-75: #404040;\n--grey-75-darker: #3a3a3a;\n--grey-75-r: 64;\n--grey-75-g: 64;\n--grey-75-b: 64;\n--grey-75-contrast: white;\n--grey-75-contrast-darker: white;\n--grey-75-text-color: var(--body-alt-color);\n--black: #000000;\n--black-darker: #000000;\n--black-r: 0;\n--black-g: 0;\n--black-b: 0;\n--black-contrast: white;\n--black-contrast-darker: white;\n--black-text-color: var(--body-alt-color);\n--grey-70: #4d4d4d;\n--grey-70-darker: #454545;\n--grey-70-r: 77;\n--grey-70-g: 77;\n--grey-70-b: 77;\n--grey-70-contrast: white;\n--grey-70-contrast-darker: white;\n--grey-70-text-color: var(--body-alt-color);\n--grey-60: #666666;\n--grey-60-darker: #5c5c5c;\n--grey-60-r: 102;\n--grey-60-g: 102;\n--grey-60-b: 102;\n--grey-60-contrast: white;\n--grey-60-contrast-darker: white;\n--grey-60-text-color: var(--body-alt-color);\n--grey-50: #808080;\n--grey-50-darker: #737373;\n--grey-50-r: 128;\n--grey-50-g: 128;\n--grey-50-b: 128;\n--grey-50-contrast: white;\n--grey-50-contrast-darker: white;\n--grey-50-text-color: var(--body-alt-color);\n--grey-dark-3: #212121;\n--grey-dark-3-darker: #1e1e1e;\n--grey-dark-3-r: 33;\n--grey-dark-3-g: 33;\n--grey-dark-3-b: 33;\n--grey-dark-3-contrast: white;\n--grey-dark-3-contrast-darker: white;\n--grey-dark-3-text-color: var(--body-alt-color);\n--grey-dark-2: #333333;\n--grey-dark-2-darker: #2e2e2e;\n--grey-dark-2-r: 51;\n--grey-dark-2-g: 51;\n--grey-dark-2-b: 51;\n--grey-dark-2-contrast: white;\n--grey-dark-2-contrast-darker: white;\n--grey-dark-2-text-color: var(--body-alt-color);\n--grey-dark-1: #454545;\n--grey-dark-1-darker: #3e3e3e;\n--grey-dark-1-r: 69;\n--grey-dark-1-g: 69;\n--grey-dark-1-b: 69;\n--grey-dark-1-contrast: white;\n--grey-dark-1-contrast-darker: white;\n--grey-dark-1-text-color: var(--body-alt-color);\n--grey: #b3b3b3;\n--grey-darker: #a1a1a1;\n--grey-r: 179;\n--grey-g: 179;\n--grey-b: 179;\n--grey-contrast: white;\n--grey-contrast-darker: white;\n--grey-text-color: var(--body-alt-color);\n--grey-light-1: #d9d9d9;\n--grey-light-1-darker: #c3c3c3;\n--grey-light-1-r: 217;\n--grey-light-1-g: 217;\n--grey-light-1-b: 217;\n--grey-light-1-contrast: black;\n--grey-light-1-contrast-darker: black;\n--grey-light-1-text-color: var(--body-color);\n--grey-light-2: #eeeeee;\n--grey-light-2-darker: #d6d6d6;\n--grey-light-2-r: 238;\n--grey-light-2-g: 238;\n--grey-light-2-b: 238;\n--grey-light-2-contrast: black;\n--grey-light-2-contrast-darker: black;\n--grey-light-2-text-color: var(--body-color);\n--grey-light-3: #f6f6f6;\n--grey-light-3-darker: #dddddd;\n--grey-light-3-r: 246;\n--grey-light-3-g: 246;\n--grey-light-3-b: 246;\n--grey-light-3-contrast: black;\n--grey-light-3-contrast-darker: black;\n--grey-light-3-text-color: var(--body-color);\n--color-1-base: #f07b0d;\n--color-1-base-darker: #d86f0c;\n--color-1-base-r: 240;\n--color-1-base-g: 123;\n--color-1-base-b: 13;\n--color-1-base-contrast: white;\n--color-1-base-contrast-darker: white;\n--color-1-base-text-color: var(--body-alt-color);\n--color-1-dark-3: #332e29;\n--color-1-dark-3-darker: #2e2925;\n--color-1-dark-3-r: 51;\n--color-1-dark-3-g: 46;\n--color-1-dark-3-b: 41;\n--color-1-dark-3-contrast: white;\n--color-1-dark-3-contrast-darker: white;\n--color-1-dark-3-text-color: var(--body-alt-color);\n--color-1-dark-2: #72583f;\n--color-1-dark-2-darker: #674f39;\n--color-1-dark-2-r: 114;\n--color-1-dark-2-g: 88;\n--color-1-dark-2-b: 63;\n--color-1-dark-2-contrast: white;\n--color-1-dark-2-contrast-darker: white;\n--color-1-dark-2-text-color: var(--body-alt-color);\n--color-1-dark-1: #b17136;\n--color-1-dark-1-darker: #9f6631;\n--color-1-dark-1-r: 177;\n--color-1-dark-1-g: 113;\n--color-1-dark-1-b: 54;\n--color-1-dark-1-contrast: white;\n--color-1-dark-1-contrast-darker: white;\n--color-1-dark-1-text-color: var(--body-alt-color);\n--color-1: #f07b0d;\n--color-1-darker: #d86f0c;\n--color-1-r: 240;\n--color-1-g: 123;\n--color-1-b: 13;\n--color-1-contrast: white;\n--color-1-contrast-darker: white;\n--color-1-text-color: var(--body-alt-color);\n--color-1-light-1: #f5a153;\n--color-1-light-1-darker: #f39034;\n--color-1-light-1-r: 245;\n--color-1-light-1-g: 161;\n--color-1-light-1-b: 83;\n--color-1-light-1-contrast: white;\n--color-1-light-1-contrast-darker: white;\n--color-1-light-1-text-color: var(--body-alt-color);\n--color-1-light-2: #f9c89b;\n--color-1-light-2-darker: #f7b375;\n--color-1-light-2-r: 249;\n--color-1-light-2-g: 200;\n--color-1-light-2-b: 155;\n--color-1-light-2-contrast: black;\n--color-1-light-2-contrast-darker: black;\n--color-1-light-2-text-color: var(--body-color);\n--color-1-light-3: #fef1e6;\n--color-1-light-3-darker: #fcd7b7;\n--color-1-light-3-r: 254;\n--color-1-light-3-g: 241;\n--color-1-light-3-b: 230;\n--color-1-light-3-contrast: black;\n--color-1-light-3-contrast-darker: black;\n--color-1-light-3-text-color: var(--body-color);\n--color-2-base: #3dd2ae;\n--color-2-base-darker: #2ec6a1;\n--color-2-base-r: 61;\n--color-2-base-g: 210;\n--color-2-base-b: 174;\n--color-2-base-contrast: black;\n--color-2-base-contrast-darker: white;\n--color-2-base-text-color: var(--body-color);\n--color-2-dark-3: #293331;\n--color-2-dark-3-darker: #252e2c;\n--color-2-dark-3-r: 41;\n--color-2-dark-3-g: 51;\n--color-2-dark-3-b: 49;\n--color-2-dark-3-contrast: white;\n--color-2-dark-3-contrast-darker: white;\n--color-2-dark-3-text-color: var(--body-alt-color);\n--color-2-dark-2: #42685f;\n--color-2-dark-2-darker: #3b5e56;\n--color-2-dark-2-r: 66;\n--color-2-dark-2-g: 104;\n--color-2-dark-2-b: 95;\n--color-2-dark-2-contrast: white;\n--color-2-dark-2-contrast-darker: white;\n--color-2-dark-2-text-color: var(--body-alt-color);\n--color-2-dark-1: #489d89;\n--color-2-dark-1-darker: #418d7b;\n--color-2-dark-1-r: 72;\n--color-2-dark-1-g: 157;\n--color-2-dark-1-b: 137;\n--color-2-dark-1-contrast: white;\n--color-2-dark-1-contrast-darker: white;\n--color-2-dark-1-text-color: var(--body-alt-color);\n--color-2: #3dd2ae;\n--color-2-darker: #2ec6a1;\n--color-2-r: 61;\n--color-2-g: 210;\n--color-2-b: 174;\n--color-2-contrast: black;\n--color-2-contrast-darker: white;\n--color-2-text-color: var(--body-color);\n--color-2-light-1: #70e0c5;\n--color-2-light-1-darker: #54daba;\n--color-2-light-1-r: 112;\n--color-2-light-1-g: 224;\n--color-2-light-1-b: 197;\n--color-2-light-1-contrast: black;\n--color-2-light-1-contrast-darker: black;\n--color-2-light-1-text-color: var(--body-color);\n--color-2-light-2: #aaeddd;\n--color-2-light-2-darker: #88e6d0;\n--color-2-light-2-r: 170;\n--color-2-light-2-g: 237;\n--color-2-light-2-b: 221;\n--color-2-light-2-contrast: black;\n--color-2-light-2-contrast-darker: black;\n--color-2-light-2-text-color: var(--body-color);\n--color-2-light-3: #e9fbf6;\n--color-2-light-3-darker: #c0f4e5;\n--color-2-light-3-r: 233;\n--color-2-light-3-g: 251;\n--color-2-light-3-b: 246;\n--color-2-light-3-contrast: black;\n--color-2-light-3-contrast-darker: black;\n--color-2-light-3-text-color: var(--body-color);\n--color-3-base: #232831;\n--color-3-base-darker: #20242c;\n--color-3-base-r: 35;\n--color-3-base-g: 40;\n--color-3-base-b: 49;\n--color-3-base-contrast: white;\n--color-3-base-contrast-darker: white;\n--color-3-base-text-color: var(--body-alt-color);\n--color-3-dark-3: #292c33;\n--color-3-dark-3-darker: #25282e;\n--color-3-dark-3-r: 41;\n--color-3-dark-3-g: 44;\n--color-3-dark-3-b: 51;\n--color-3-dark-3-contrast: white;\n--color-3-dark-3-contrast-darker: white;\n--color-3-dark-3-text-color: var(--body-alt-color);\n--color-3-dark-2: #464e5b;\n--color-3-dark-2-darker: #3f4652;\n--color-3-dark-2-r: 70;\n--color-3-dark-2-g: 78;\n--color-3-dark-2-b: 91;\n--color-3-dark-2-contrast: white;\n--color-3-dark-2-contrast-darker: white;\n--color-3-dark-2-text-color: var(--body-alt-color);\n--color-3-dark-1: #6f7786;\n--color-3-dark-1-darker: #646b79;\n--color-3-dark-1-r: 111;\n--color-3-dark-1-g: 119;\n--color-3-dark-1-b: 134;\n--color-3-dark-1-contrast: white;\n--color-3-dark-1-contrast-darker: white;\n--color-3-dark-1-text-color: var(--body-alt-color);\n--color-3: #9ca3b0;\n--color-3-darker: #8a92a1;\n--color-3-r: 156;\n--color-3-g: 163;\n--color-3-b: 176;\n--color-3-contrast: white;\n--color-3-contrast-darker: white;\n--color-3-text-color: var(--body-alt-color);\n--color-3-light-1: #b8bdc8;\n--color-3-light-1-darker: #a2a9b7;\n--color-3-light-1-r: 184;\n--color-3-light-1-g: 189;\n--color-3-light-1-b: 200;\n--color-3-light-1-contrast: black;\n--color-3-light-1-contrast-darker: white;\n--color-3-light-1-text-color: var(--body-color);\n--color-3-light-2: #d5d9df;\n--color-3-light-2-darker: #bcc3cc;\n--color-3-light-2-r: 213;\n--color-3-light-2-g: 217;\n--color-3-light-2-b: 223;\n--color-3-light-2-contrast: black;\n--color-3-light-2-contrast-darker: black;\n--color-3-light-2-text-color: var(--body-color);\n--color-3-light-3: #f4f5f7;\n--color-3-light-3-darker: #d8dbe2;\n--color-3-light-3-r: 244;\n--color-3-light-3-g: 245;\n--color-3-light-3-b: 247;\n--color-3-light-3-contrast: black;\n--color-3-light-3-contrast-darker: black;\n--color-3-light-3-text-color: var(--body-color);\n--color-4-base: #2b303b;\n--color-4-base-darker: #272b35;\n--color-4-base-r: 43;\n--color-4-base-g: 48;\n--color-4-base-b: 59;\n--color-4-base-contrast: white;\n--color-4-base-contrast-darker: white;\n--color-4-base-text-color: var(--body-alt-color);\n--color-4-dark-3: #292c33;\n--color-4-dark-3-darker: #25282e;\n--color-4-dark-3-r: 41;\n--color-4-dark-3-g: 44;\n--color-4-dark-3-b: 51;\n--color-4-dark-3-contrast: white;\n--color-4-dark-3-contrast-darker: white;\n--color-4-dark-3-text-color: var(--body-alt-color);\n--color-4-dark-2: #4d5362;\n--color-4-dark-2-darker: #454b58;\n--color-4-dark-2-r: 77;\n--color-4-dark-2-g: 83;\n--color-4-dark-2-b: 98;\n--color-4-dark-2-contrast: white;\n--color-4-dark-2-contrast-darker: white;\n--color-4-dark-2-text-color: var(--body-alt-color);\n--color-4-dark-1: #727989;\n--color-4-dark-1-darker: #676d7b;\n--color-4-dark-1-r: 114;\n--color-4-dark-1-g: 121;\n--color-4-dark-1-b: 137;\n--color-4-dark-1-contrast: white;\n--color-4-dark-1-contrast-darker: white;\n--color-4-dark-1-text-color: var(--body-alt-color);\n--color-4: #9ca2b0;\n--color-4-darker: #8a91a1;\n--color-4-r: 156;\n--color-4-g: 162;\n--color-4-b: 176;\n--color-4-contrast: white;\n--color-4-contrast-darker: white;\n--color-4-text-color: var(--body-alt-color);\n--color-4-light-1: #b8bdc7;\n--color-4-light-1-darker: #a3a9b6;\n--color-4-light-1-r: 184;\n--color-4-light-1-g: 189;\n--color-4-light-1-b: 199;\n--color-4-light-1-contrast: black;\n--color-4-light-1-contrast-darker: white;\n--color-4-light-1-text-color: var(--body-color);\n--color-4-light-2: #d5d8df;\n--color-4-light-2-darker: #bcc1cc;\n--color-4-light-2-r: 213;\n--color-4-light-2-g: 216;\n--color-4-light-2-b: 223;\n--color-4-light-2-contrast: black;\n--color-4-light-2-contrast-darker: black;\n--color-4-light-2-text-color: var(--body-color);\n--color-4-light-3: #f4f5f7;\n--color-4-light-3-darker: #d8dbe2;\n--color-4-light-3-r: 244;\n--color-4-light-3-g: 245;\n--color-4-light-3-b: 247;\n--color-4-light-3-contrast: black;\n--color-4-light-3-contrast-darker: black;\n--color-4-light-3-text-color: var(--body-color);\n--color-5-base: #b8c1cc;\n--color-5-base-darker: #a1adbc;\n--color-5-base-r: 184;\n--color-5-base-g: 193;\n--color-5-base-b: 204;\n--color-5-base-contrast: black;\n--color-5-base-contrast-darker: white;\n--color-5-base-text-color: var(--body-color);\n--color-5-dark-3: #292d33;\n--color-5-dark-3-darker: #25292e;\n--color-5-dark-3-r: 41;\n--color-5-dark-3-g: 45;\n--color-5-dark-3-b: 51;\n--color-5-dark-3-contrast: white;\n--color-5-dark-3-contrast-darker: white;\n--color-5-dark-3-text-color: var(--body-alt-color);\n--color-5-dark-2: #555d66;\n--color-5-dark-2-darker: #4d545c;\n--color-5-dark-2-r: 85;\n--color-5-dark-2-g: 93;\n--color-5-dark-2-b: 102;\n--color-5-dark-2-contrast: white;\n--color-5-dark-2-contrast-darker: white;\n--color-5-dark-2-text-color: var(--body-alt-color);\n--color-5-dark-1: #858e99;\n--color-5-dark-1-darker: #75808c;\n--color-5-dark-1-r: 133;\n--color-5-dark-1-g: 142;\n--color-5-dark-1-b: 153;\n--color-5-dark-1-contrast: white;\n--color-5-dark-1-contrast-darker: white;\n--color-5-dark-1-text-color: var(--body-alt-color);\n--color-5: #b8c1cc;\n--color-5-darker: #a1adbc;\n--color-5-r: 184;\n--color-5-g: 193;\n--color-5-b: 204;\n--color-5-contrast: black;\n--color-5-contrast-darker: white;\n--color-5-text-color: var(--body-color);\n--color-5-light-1: #ccd3db;\n--color-5-light-1-darker: #b3bec9;\n--color-5-light-1-r: 204;\n--color-5-light-1-g: 211;\n--color-5-light-1-b: 219;\n--color-5-light-1-contrast: black;\n--color-5-light-1-contrast-darker: black;\n--color-5-light-1-text-color: var(--body-color);\n--color-5-light-2: #e0e5eb;\n--color-5-light-2-darker: #c4ced9;\n--color-5-light-2-r: 224;\n--color-5-light-2-g: 229;\n--color-5-light-2-b: 235;\n--color-5-light-2-contrast: black;\n--color-5-light-2-contrast-darker: black;\n--color-5-light-2-text-color: var(--body-color);\n--color-5-light-3: #f5f7fa;\n--color-5-light-3-darker: #d4dde9;\n--color-5-light-3-r: 245;\n--color-5-light-3-g: 247;\n--color-5-light-3-b: 250;\n--color-5-light-3-contrast: black;\n--color-5-light-3-contrast-darker: black;\n--color-5-light-3-text-color: var(--body-color);\n--white-contrast: var(--body-color);\n--shading-contrast: var(--body-alt-color);\n--bg-contrast: var(--body-color);\n}</style><style id=\"typography\" typography=\"Normal\">\n        .u-body\n        {\n        --title-font-weight: 400;\n        --title-font-size: 4.5rem;\n        --title-line-height: 1.1;\n        --title-margin-top: 20px;\n        --title-margin-bottom: 20px;\n        --subtitle-font-weight: 400;\n        --subtitle-font-size: 2.25rem;\n        --subtitle-line-height: 1.1;\n        --subtitle-margin-top: 20px;\n        --subtitle-margin-bottom: 20px;\n        --h1-font-weight: 400;\n        --h1-font-size: 3rem;\n        --h1-line-height: 1.1;\n        --h1-margin-top: 20px;\n        --h1-margin-bottom: 20px;\n        --h2-font-weight: 400;\n        --h2-font-size: 2.25rem;\n        --h2-line-height: 1.1;\n        --h2-margin-top: 20px;\n        --h2-margin-bottom: 20px;\n        --h3-font-weight: 400;\n        --h3-font-size: 1.875rem;\n        --h3-line-height: 1.2;\n        --h3-margin-top: 20px;\n        --h3-margin-bottom: 20px;\n        --h4-font-weight: 400;\n        --h4-font-size: 1.5rem;\n        --h4-line-height: 1.2;\n        --h4-margin-top: 20px;\n        --h4-margin-bottom: 20px;\n        --h5-font-weight: 400;\n        --h5-font-size: 1.25rem;\n        --h5-line-height: 1.2;\n        --h5-margin-top: 20px;\n        --h5-margin-bottom: 20px;\n        --h6-font-weight: 400;\n        --h6-font-size: 1.125rem;\n        --h6-line-height: 1.2;\n        --h6-margin-top: 20px;\n        --h6-margin-bottom: 20px;\n        --largeText-font-size: 1.25rem;\n        --largeText-margin-top: 20px;\n        --largeText-margin-bottom: 20px;\n        --smallText-font-size: 0.875rem;\n        --smallText-margin-top: 20px;\n        --smallText-margin-bottom: 20px;\n        --text-margin-top: 20px;\n        --text-margin-bottom: 20px;\n        --hyperlink-color: var(--palette-1-base);\n        --hyperlink-alt-text-color: var(--palette-1-light-2);\n        --hyperlink-hover-color: var(--palette-1-base-darker);\n        --hyperlink-hover-alt-text-color: var(--grey-30-darker);\n        --button-margin-top: 20px;\n        --button-margin-bottom: 20px;\n        --button-background-color: var(--palette-1-base);\n        --button-color: var(--white);\n        --button-alt-background-color: var(--palette-1-light-2);\n        --button-alt-color: var(--black);\n        --button-hover-background-color: var(--palette-1-base-darker);\n        --button-hover-color: var(--white-darker);\n        --button-hover-alt-background-color: var(--palette-1-light-2-darker);\n        --button-hover-alt-color: var(--white);\n        --button-hover-background-color: var(--palette-1-base-darker);\n        --button-hover-color: var(--white-darker);\n        --button-hover-alt-background-color: var(--palette-1-light-2-darker);\n        --button-hover-alt-color: var(--white);\n        --button-active-background-color: var(--palette-1-base-darker);\n        --button-active-color: var(--white-darker);\n        --button-active-alt-background-color: var(--palette-1-light-2-darker);\n        --button-active-alt-color: var(--white);\n        --blockquote-font-style: italic;\n        --blockquote-padding-left: 20px;\n        --blockquote-border-width: 4px;\n        --blockquote-border-color: var(--palette-1-base);\n        --blockquote-margin-top: 20px;\n        --blockquote-margin-bottom: 20px;\n        --metadata-margin-top: 20px;\n        --metadata-margin-bottom: 20px;\n        --list-margin-top: 20px;\n        --list-margin-bottom: 20px;\n        --orderedlist-margin-top: 20px;\n        --orderedlist-margin-bottom: 20px;\n        --postContent-margin-top: 20px;\n        --postContent-margin-bottom: 20px;\n        --theme-sheet-width-xl: 1140px;\n        --theme-sheet-width-lg: 940px;\n        --theme-sheet-width-md: 720px;\n        --theme-sheet-width-sm: 540px;\n        --theme-sheet-width-xs: 340px;\n        --title-font-size-sm: 3.75rem;\n        --title-font-size-xs: 3rem;\n        --subtitle-font-size-xs: 1.5rem;\n        --h1-font-size-xs: 1.875rem;\n        --h2-font-size-xs: 1.5rem;\n        --h3-font-size-xs: 1.5rem;\n        }\n\n        /** common-rules **/\n        h1.u-title\n        {\n        font-weight: var(--title-font-weight);\n        font-size: var(--title-font-size);\n        line-height: var(--title-line-height);\n        margin-top: var(--title-margin-top);\n        margin-bottom: var(--title-margin-bottom);\n        }\n        h2.u-subtitle\n        {\n        font-weight: var(--subtitle-font-weight);\n        font-size: var(--subtitle-font-size);\n        line-height: var(--subtitle-line-height);\n        margin-top: var(--subtitle-margin-top);\n        margin-bottom: var(--subtitle-margin-bottom);\n        }\n        h1:not(.u-title)\n        {\n        font-weight: var(--h1-font-weight);\n        font-size: var(--h1-font-size);\n        line-height: var(--h1-line-height);\n        margin-top: var(--h1-margin-top);\n        margin-bottom: var(--h1-margin-bottom);\n        }\n        h2:not(.u-subtitle)\n        {\n        font-weight: var(--h2-font-weight);\n        font-size: var(--h2-font-size);\n        line-height: var(--h2-line-height);\n        margin-top: var(--h2-margin-top);\n        margin-bottom: var(--h2-margin-bottom);\n        }\n        h3\n        {\n        font-weight: var(--h3-font-weight);\n        font-size: var(--h3-font-size);\n        line-height: var(--h3-line-height);\n        margin-top: var(--h3-margin-top);\n        margin-bottom: var(--h3-margin-bottom);\n        }\n        h4\n        {\n        font-weight: var(--h4-font-weight);\n        font-size: var(--h4-font-size);\n        line-height: var(--h4-line-height);\n        margin-top: var(--h4-margin-top);\n        margin-bottom: var(--h4-margin-bottom);\n        }\n        h5\n        {\n        font-weight: var(--h5-font-weight);\n        font-size: var(--h5-font-size);\n        line-height: var(--h5-line-height);\n        margin-top: var(--h5-margin-top);\n        margin-bottom: var(--h5-margin-bottom);\n        }\n        h6\n        {\n        font-weight: var(--h6-font-weight);\n        font-size: var(--h6-font-size);\n        line-height: var(--h6-line-height);\n        margin-top: var(--h6-margin-top);\n        margin-bottom: var(--h6-margin-bottom);\n        }\n        p.u-large-text\n        {\n        font-size: var(--largeText-font-size);\n        margin-top: var(--largeText-margin-top);\n        margin-bottom: var(--largeText-margin-bottom);\n        }\n        p.u-small-text\n        {\n        font-size: var(--smallText-font-size);\n        margin-top: var(--smallText-margin-top);\n        margin-bottom: var(--smallText-margin-bottom);\n        }\n        p:not(.u-text-variant)\n        {\n        margin-top: var(--text-margin-top);\n        margin-bottom: var(--text-margin-bottom);\n        }\n        .u-btn\n        {\n        margin-top: var(--button-margin-top);\n        margin-bottom: var(--button-margin-bottom);\n        }\n        blockquote\n        {\n        font-style: var(--blockquote-font-style);\n        padding-left: var(--blockquote-padding-left);\n        border-width: var(--blockquote-border-width);\n        margin-top: var(--blockquote-margin-top);\n        margin-bottom: var(--blockquote-margin-bottom);\n        }\n        .u-metadata\n        {\n        margin-top: var(--metadata-margin-top);\n        margin-bottom: var(--metadata-margin-bottom);\n        }\n        ul:not(.u-unstyled)\n        {\n        margin-top: var(--list-margin-top);\n        margin-bottom: var(--list-margin-bottom);\n        }\n        ol\n        {\n        margin-top: var(--orderedlist-margin-top);\n        margin-bottom: var(--orderedlist-margin-bottom);\n        }\n        .u-post-content\n        {\n        margin-top: var(--postContent-margin-top);\n        margin-bottom: var(--postContent-margin-bottom);\n        }\n        /** common-rules **/\n\n        /** publish-rules **/\n        /*begin-media rules*/\n        @media (max-width: 767px) {\n        h1.u-title\n        {\n        font-size: var(--title-font-size-sm);\n        }\n        }\n        @media (max-width: 575px) {\n        h1.u-title\n        {\n        font-size: var(--title-font-size-xs);\n        }\n        }\n        @media (max-width: 575px) {\n        h2.u-subtitle\n        {\n        font-size: var(--subtitle-font-size-xs);\n        }\n        }\n        @media (max-width: 575px) {\n        h1:not(.u-title)\n        {\n        font-size: var(--h1-font-size-xs);\n        }\n        }\n        @media (max-width: 575px) {\n        h2:not(.u-subtitle)\n        {\n        font-size: var(--h2-font-size-xs);\n        }\n        }\n        @media (max-width: 575px) {\n        h3\n        {\n        font-size: var(--h3-font-size-xs);\n        }\n        }\n        /*end-media rules*/\n        /** publish-rules **/\n\n        \n\n        /** cms-rules **/\n        /*begin-responsive rules*/\n        .u-sm h1.u-title\n        {\n        font-size: var(--title-font-size-sm);\n        }\n        .u-xs h1.u-title\n        {\n        font-size: var(--title-font-size-xs);\n        }\n        .u-xs h2.u-subtitle\n        {\n        font-size: var(--subtitle-font-size-xs);\n        }\n        .u-xs h1:not(.u-title)\n        {\n        font-size: var(--h1-font-size-xs);\n        }\n        .u-xs h2:not(.u-subtitle)\n        {\n        font-size: var(--h2-font-size-xs);\n        }\n        .u-xs h3\n        {\n        font-size: var(--h3-font-size-xs);\n        }\n        /*end-responsive rules*/\n        /** cms-rules **/\n\n        /** color-rules **/\n        .u-overlap.u-overlap-transparent:not(.u-overlap-contrast) .u-header :not(.u-nav-item) > a,\n        .u-gradient > .u-container-layout > a,\n        .u-image:not(.u-shading) > .u-container-layout > a,\n        a\n        {\n        color: var(--hyperlink-color);\n        }\n        .u-overlap.u-overlap-transparent:not(.u-overlap-contrast) .u-header :not(.u-nav-item) > a:hover,\n        .u-gradient > .u-container-layout > a:hover,\n        .u-image:not(.u-shading) > .u-container-layout > a:hover,\n        a:hover\n        {\n        color: var(--hyperlink-hover-color);\n        }\n        .u-overlap.u-overlap-transparent:not(.u-overlap-contrast) .u-header :not(.u-nav-item) > .u-btn,\n        .u-gradient > .u-container-layout > .u-btn,\n        .u-image:not(.u-shading) > .u-container-layout > .u-btn,\n        .u-btn\n        {\n        background-color: var(--button-background-color);\n        color: var(--button-color);\n        }\n        .u-overlap.u-overlap-transparent:not(.u-overlap-contrast) .u-header :not(.u-nav-item) > .u-btn:hover,\n        .u-gradient > .u-container-layout > .u-btn:hover,\n        .u-image:not(.u-shading) > .u-container-layout > .u-btn:hover,\n        .u-btn:hover\n        {\n        background-color: var(--button-hover-background-color);\n        color: var(--button-hover-color);\n        }\n        .u-overlap.u-overlap-transparent:not(.u-overlap-contrast) .u-header :not(.u-nav-item) > .u-btn:focus,\n        .u-gradient > .u-container-layout > .u-btn:focus,\n        .u-image:not(.u-shading) > .u-container-layout > .u-btn:focus,\n        .u-btn:focus\n        {\n        background-color: var(--button-hover-background-color);\n        color: var(--button-hover-color);\n        }\n        .u-overlap.u-overlap-transparent:not(.u-overlap-contrast) .u-header :not(.u-nav-item) > .u-btn:active,\n        .u-gradient > .u-container-layout > .u-btn:active,\n        .u-image:not(.u-shading) > .u-container-layout > .u-btn:active,\n        .u-btn:active\n        {\n        background-color: var(--button-active-background-color);\n        color: var(--button-active-color);\n        }\n        .u-overlap.u-overlap-transparent:not(.u-overlap-contrast) .u-header :not(.u-nav-item) > blockquote,\n        .u-gradient > .u-container-layout > blockquote,\n        .u-image:not(.u-shading) > .u-container-layout > blockquote,\n        blockquote\n        {\n        border-color: var(--blockquote-border-color);\n        }\n        /** color-rules **/\n\n        /** alt-color-rules **/\n        .u-body-color a,.u-palette-1-base a,.u-palette-1-dark-3 a,.u-palette-1-dark-2 a,.u-palette-1-dark-1 a,.u-palette-1 a,.u-palette-1-light-1 a,.u-palette-2-dark-3 a,.u-palette-2-dark-2 a,.u-palette-2-dark-1 a,.u-palette-3-base a,.u-palette-3-dark-3 a,.u-palette-3-dark-2 a,.u-palette-3-dark-1 a,.u-palette-3 a,.u-palette-4-base a,.u-palette-4-dark-3 a,.u-palette-4-dark-2 a,.u-palette-4-dark-1 a,.u-palette-4 a,.u-palette-5-dark-3 a,.u-palette-5-dark-2 a,.u-palette-5-dark-1 a,.u-grey-40 a,.u-grey-30 a,.u-grey-90 a,.u-grey-80 a,.u-grey-75 a,.u-black a,.u-grey-70 a,.u-grey-60 a,.u-grey-50 a,.u-grey-dark-3 a,.u-grey-dark-2 a,.u-grey-dark-1 a,.u-grey a,.u-shading a,.u-overlap-contrast .u-header a:not(.u-nav-link):not(.u-btn)\n        {\n        color: var(--hyperlink-alt-text-color);\n        }\n        .u-body-color a:hover,.u-palette-1-base a:hover,.u-palette-1-dark-3 a:hover,.u-palette-1-dark-2 a:hover,.u-palette-1-dark-1 a:hover,.u-palette-1 a:hover,.u-palette-1-light-1 a:hover,.u-palette-2-dark-3 a:hover,.u-palette-2-dark-2 a:hover,.u-palette-2-dark-1 a:hover,.u-palette-3-base a:hover,.u-palette-3-dark-3 a:hover,.u-palette-3-dark-2 a:hover,.u-palette-3-dark-1 a:hover,.u-palette-3 a:hover,.u-palette-4-base a:hover,.u-palette-4-dark-3 a:hover,.u-palette-4-dark-2 a:hover,.u-palette-4-dark-1 a:hover,.u-palette-4 a:hover,.u-palette-5-dark-3 a:hover,.u-palette-5-dark-2 a:hover,.u-palette-5-dark-1 a:hover,.u-grey-40 a:hover,.u-grey-30 a:hover,.u-grey-90 a:hover,.u-grey-80 a:hover,.u-grey-75 a:hover,.u-black a:hover,.u-grey-70 a:hover,.u-grey-60 a:hover,.u-grey-50 a:hover,.u-grey-dark-3 a:hover,.u-grey-dark-2 a:hover,.u-grey-dark-1 a:hover,.u-grey a:hover\n        {\n        color: var(--hyperlink-hover-alt-text-color);\n        }\n        .u-body-color .u-btn,.u-palette-1-base .u-btn,.u-palette-1-dark-3 .u-btn,.u-palette-1-dark-2 .u-btn,.u-palette-1-dark-1 .u-btn,.u-palette-1 .u-btn,.u-palette-1-light-1 .u-btn,.u-palette-2-dark-3 .u-btn,.u-palette-2-dark-2 .u-btn,.u-palette-2-dark-1 .u-btn,.u-palette-3-base .u-btn,.u-palette-3-dark-3 .u-btn,.u-palette-3-dark-2 .u-btn,.u-palette-3-dark-1 .u-btn,.u-palette-3 .u-btn,.u-palette-4-base .u-btn,.u-palette-4-dark-3 .u-btn,.u-palette-4-dark-2 .u-btn,.u-palette-4-dark-1 .u-btn,.u-palette-4 .u-btn,.u-palette-5-dark-3 .u-btn,.u-palette-5-dark-2 .u-btn,.u-palette-5-dark-1 .u-btn,.u-grey-40 .u-btn,.u-grey-30 .u-btn,.u-grey-90 .u-btn,.u-grey-80 .u-btn,.u-grey-75 .u-btn,.u-black .u-btn,.u-grey-70 .u-btn,.u-grey-60 .u-btn,.u-grey-50 .u-btn,.u-grey-dark-3 .u-btn,.u-grey-dark-2 .u-btn,.u-grey-dark-1 .u-btn,.u-grey .u-btn,.u-shading .u-btn,.u-overlap-contrast .u-header .u-btn\n        {\n        background-color: var(--button-alt-background-color);\n        color: var(--button-alt-color);\n        }\n        .u-body-color .u-btn:hover,.u-palette-1-base .u-btn:hover,.u-palette-1-dark-3 .u-btn:hover,.u-palette-1-dark-2 .u-btn:hover,.u-palette-1-dark-1 .u-btn:hover,.u-palette-1 .u-btn:hover,.u-palette-1-light-1 .u-btn:hover,.u-palette-2-dark-3 .u-btn:hover,.u-palette-2-dark-2 .u-btn:hover,.u-palette-2-dark-1 .u-btn:hover,.u-palette-3-base .u-btn:hover,.u-palette-3-dark-3 .u-btn:hover,.u-palette-3-dark-2 .u-btn:hover,.u-palette-3-dark-1 .u-btn:hover,.u-palette-3 .u-btn:hover,.u-palette-4-base .u-btn:hover,.u-palette-4-dark-3 .u-btn:hover,.u-palette-4-dark-2 .u-btn:hover,.u-palette-4-dark-1 .u-btn:hover,.u-palette-4 .u-btn:hover,.u-palette-5-dark-3 .u-btn:hover,.u-palette-5-dark-2 .u-btn:hover,.u-palette-5-dark-1 .u-btn:hover,.u-grey-40 .u-btn:hover,.u-grey-30 .u-btn:hover,.u-grey-90 .u-btn:hover,.u-grey-80 .u-btn:hover,.u-grey-75 .u-btn:hover,.u-black .u-btn:hover,.u-grey-70 .u-btn:hover,.u-grey-60 .u-btn:hover,.u-grey-50 .u-btn:hover,.u-grey-dark-3 .u-btn:hover,.u-grey-dark-2 .u-btn:hover,.u-grey-dark-1 .u-btn:hover,.u-grey .u-btn:hover,.u-shading .u-btn:hover,.u-overlap-contrast .u-header .u-btn:hover\n        {\n        background-color: var(--button-hover-alt-background-color);\n        color: var(--button-hover-alt-color);\n        }\n        .u-body-color .u-btn:active,.u-palette-1-base .u-btn:active,.u-palette-1-dark-3 .u-btn:active,.u-palette-1-dark-2 .u-btn:active,.u-palette-1-dark-1 .u-btn:active,.u-palette-1 .u-btn:active,.u-palette-1-light-1 .u-btn:active,.u-palette-2-dark-3 .u-btn:active,.u-palette-2-dark-2 .u-btn:active,.u-palette-2-dark-1 .u-btn:active,.u-palette-3-base .u-btn:active,.u-palette-3-dark-3 .u-btn:active,.u-palette-3-dark-2 .u-btn:active,.u-palette-3-dark-1 .u-btn:active,.u-palette-3 .u-btn:active,.u-palette-4-base .u-btn:active,.u-palette-4-dark-3 .u-btn:active,.u-palette-4-dark-2 .u-btn:active,.u-palette-4-dark-1 .u-btn:active,.u-palette-4 .u-btn:active,.u-palette-5-dark-3 .u-btn:active,.u-palette-5-dark-2 .u-btn:active,.u-palette-5-dark-1 .u-btn:active,.u-grey-40 .u-btn:active,.u-grey-30 .u-btn:active,.u-grey-90 .u-btn:active,.u-grey-80 .u-btn:active,.u-grey-75 .u-btn:active,.u-black .u-btn:active,.u-grey-70 .u-btn:active,.u-grey-60 .u-btn:active,.u-grey-50 .u-btn:active,.u-grey-dark-3 .u-btn:active,.u-grey-dark-2 .u-btn:active,.u-grey-dark-1 .u-btn:active,.u-grey .u-btn:active,.u-shading .u-btn:active,.u-overlap-contrast .u-header .u-btn:active\n        {\n        background-color: var(--button-active-alt-background-color);\n        color: var(--button-active-alt-color);\n        }\n        /** alt-color-rules **/\n    </style><style id=\"font-scheme\" font-scheme=\"Roboto-OpenSans\" heading-font=\"Roboto,sans-serif\" text-font=\"'Open Sans',sans-serif\">.u-body {\n   --text-font: 'Open Sans',sans-serif;\n   --heading-font: Roboto,sans-serif;\n}</style>","appVersion":"4.5.4","isTrial":false}